{"ConceptSets":[{"id":0,"name":"Lab","expression":{"items":[{"concept":{"CONCEPT_ID":3004249}}]}},{"id":1,"name":"Censor lab","expression":{"items":[{"concept":{"CONCEPT_ID":3004249}}]}}],"PrimaryCriteria":{"CriteriaList":[{"Measurement":{"CodesetId":0,"ValueAsNumber":{"Op":"gte","Value":5}}}],"ObservationWindow":{"PriorDays":0,"PostDays":0},"PrimaryCriteriaLimit":{"Type":"First"}},"QualifiedLimit":{"Type":"All"},"ExpressionLimit":{"Type":"All"},"EndStrategy":{"DateOffset":{"DateField":"EndDate","Offset":0}},"CensoringCriteria":[{"Measurement":{"CodesetId":1}}],"CollapseSettings":{"CollapseType":"ERA","EraPad":0},"CensorWindow":{}}
