{"ConceptSets":[{"id":1,"name":"Lab","expression":{"items":[{"concept":{"CONCEPT_ID":3004249}}]}}],"PrimaryCriteria":{"CriteriaList":[{"Measurement":{"CodesetId":1,"ValueAsNumber":{"Op":"gte","Value":5},"Unit":[{"CONCEPT_ID":8713,"CONCEPT_NAME":"gram per deciliter"}]}}],"ObservationWindow":{"PriorDays":0,"PostDays":0},"PrimaryCriteriaLimit":{"Type":"First"}},"QualifiedLimit":{"Type":"All"},"ExpressionLimit":{"Type":"All"},"EndStrategy":{"DateOffset":{"DateField":"EndDate","Offset":0}},"CensoringCriteria":[],"CollapseSettings":{"CollapseType":"ERA","EraPad":0},"CensorWindow":{}}
