{"cdmVersionRange":">=5.0.0","ConceptSets":[{"id":1,"name":"T2DM","expression":{"items":[{"concept":{"CONCEPT_ID":201826}}]}},{"id":2,"name":"HbA1c","expression":{"items":[{"concept":{"CONCEPT_ID":3004410}}]}}],"PrimaryCriteria":{"CriteriaList":[{"ConditionOccurrence":{"CodesetId":1,"ConditionType":[{"CONCEPT_ID":32817,"CONCEPT_NAME":"EHR"},{"CONCEPT_ID":32810,"CONCEPT_NAME":"Claim"}],"ConditionStatus":[{"CONCEPT_ID":32901,"CONCEPT_NAME":"Primary diagnosis"}]}}],"ObservationWindow":{"PriorDays":0,"PostDays":0},"PrimaryCriteriaLimit":{"Type":"First"}},"QualifiedLimit":{"Type":"First"},"ExpressionLimit":{"Type":"First"},"InclusionRules":[{"name":"Has HbA1c measurement","expression":{"Type":"ALL","CriteriaList":[{"Criteria":{"Measurement":{"CodesetId":2,"MeasurementType":[{"CONCEPT_ID":32817,"CONCEPT_NAME":"EHR"}],"Unit":[{"CONCEPT_ID":8554,"CONCEPT_NAME":"percent"}]}},"StartWindow":{"Start":{"Coeff":-1},"End":{"Coeff":1},"UseEventEnd":false},"Occurrence":{"Type":2,"Count":1}}],"DemographicCriteriaList":[],"Groups":[]}}],"CensoringCriteria":[],"CollapseSettings":{"CollapseType":"ERA","EraPad":0},"CensorWindow":{},"EndStrategy":{"DateOffset":{"DateField":"EndDate","Offset":0}}}
