{"ConceptSets":[{"id":1,"name":"Drug set","expression":{"items":[{"concept":{"CONCEPT_ID":19016586},"includeDescendants":true}]}}],"PrimaryCriteria":{"CriteriaList":[{"ConditionOccurrence":{"CodesetId":1}}],"ObservationWindow":{"PriorDays":0,"PostDays":0},"PrimaryCriteriaLimit":{"Type":"First"}},"QualifiedLimit":{"Type":"All"},"ExpressionLimit":{"Type":"All"},"EndStrategy":{"CustomEra":{"DrugCodesetId":1,"GapDays":30,"Offset":0}},"CensoringCriteria":[],"CollapseSettings":{"CollapseType":"ERA","EraPad":0},"CensorWindow":{}}
