{"cdmVersionRange":">=5.0.0","ConceptSets":[{"id":1,"name":"Condition","expression":{"items":[{"concept":{"CONCEPT_ID":313217}}]}}],"PrimaryCriteria":{"CriteriaList":[{"ConditionOccurrence":{"CodesetId":1,"ConditionTypeExclude":false}}],"ObservationWindow":{"PriorDays":0,"PostDays":0},"PrimaryCriteriaLimit":{"Type":"First"}},"QualifiedLimit":{"Type":"First"},"ExpressionLimit":{"Type":"First"},"InclusionRules":[],"EndStrategy":{"DateOffset":{"DateField":"EndDate","Offset":0}},"CensoringCriteria":[{"Death":{}}],"CollapseSettings":{"CollapseType":"ERA","EraPad":0},"CensorWindow":{}}
