{"ConceptSets":[{"id":1,"name":"Cond","expression":{"items":[{"concept":{"CONCEPT_ID":313217}}]}},{"id":2,"name":"Drug","expression":{"items":[{"concept":{"CONCEPT_ID":19016586}}]}}],"PrimaryCriteria":{"CriteriaList":[{"DrugEra":{"CodesetId":2,"CorrelatedCriteria":{"Type":"ALL","CriteriaList":[{"Criteria":{"ConditionOccurrence":{"CodesetId":1}}}],"DemographicCriteriaList":[],"Groups":[]}}}],"ObservationWindow":{"PriorDays":0,"PostDays":0},"PrimaryCriteriaLimit":{"Type":"First"}},"QualifiedLimit":{"Type":"All"},"ExpressionLimit":{"Type":"All"},"EndStrategy":{"DateOffset":{"DateField":"EndDate","Offset":0}},"CensoringCriteria":[],"CollapseSettings":{"CollapseType":"ERA","EraPad":0},"CensorWindow":{}}
