{"cdmVersionRange":">=5.0.0","ConceptSets":[],"PrimaryCriteria":{"CriteriaList":[{"ConditionOccurrence":{"OccurrenceStartDate":{"Value":"2015-01-01","Op":"gt"},"ConditionTypeExclude":false}}],"ObservationWindow":{"PriorDays":0,"PostDays":0},"PrimaryCriteriaLimit":{"Type":"First"}},"QualifiedLimit":{"Type":"First"},"ExpressionLimit":{"Type":"First"},"InclusionRules":[],"EndStrategy":{"DateOffset":{"DateField":"StartDate","Offset":1}},"CensoringCriteria":[],"CollapseSettings":{"CollapseType":"ERA","EraPad":0},"CensorWindow":{}}
