{"ConceptSets":[{"id":0,"name":"Observation period","expression":{"items":[]}}],"PrimaryCriteria":{"CriteriaList":[{"ObservationPeriod":{"CodesetId":0,"UserDefinedPeriod":{"StartDate":"2020-01-01","EndDate":"2020-12-31"}}}],"ObservationWindow":{"PriorDays":0,"PostDays":0},"PrimaryCriteriaLimit":{"Type":"First"}},"QualifiedLimit":{"Type":"All"},"ExpressionLimit":{"Type":"All"},"EndStrategy":{"DateOffset":{"DateField":"EndDate","Offset":0}},"CensoringCriteria":[],"CollapseSettings":{"CollapseType":"ERA","EraPad":0},"CensorWindow":{}}
