{"cdmVersionRange":">=5.0.0","ConceptSets":[{"id":1,"name":"Lab","expression":{"items":[{"concept":{"CONCEPT_ID":3004249}}]}}],"PrimaryCriteria":{"CriteriaList":[{"Observation":{"CodesetId":1,"ValueAsString":{"Op":"contains","Value":"positive"}}}],"ObservationWindow":{"PriorDays":0,"PostDays":0},"PrimaryCriteriaLimit":{"Type":"First"}},"QualifiedLimit":{"Type":"First"},"ExpressionLimit":{"Type":"First"},"InclusionRules":[],"CensoringCriteria":[],"CollapseSettings":{"CollapseType":"ERA","EraPad":0},"CensorWindow":{},"EndStrategy":{"DateOffset":{"DateField":"EndDate","Offset":0}}}
