{"cdmVersionRange":">=5.0.0","ConceptSets":[{"id":1,"name":"Asthma","expression":{"items":[{"concept":{"CONCEPT_ID":317009}}]}}],"PrimaryCriteria":{"CriteriaList":[{"ConditionOccurrence":{"CodesetId":1,"ConditionTypeExclude":false}}],"ObservationWindow":{"PriorDays":0,"PostDays":0},"PrimaryCriteriaLimit":{"Type":"First"}},"QualifiedLimit":{"Type":"First"},"ExpressionLimit":{"Type":"First"},"InclusionRules":[{"name":"After 2020","expression":{"Type":"ALL","CriteriaList":[],"DemographicCriteriaList":[{"OccurrenceStartDate":{"Value":"2020-01-01","Op":"gte"}}],"Groups":[]}}],"CensoringCriteria":[],"CollapseSettings":{"CollapseType":"ERA","EraPad":0},"CensorWindow":{},"EndStrategy":{"DateOffset":{"DateField":"EndDate","Offset":0}}}
