{"ConceptSets":[{"id":1,"name":"Inpatient","expression":{"items":[{"concept":{"CONCEPT_ID":9201}}]}}],"PrimaryCriteria":{"CriteriaList":[{"VisitOccurrence":{"CodesetId":1,"ProviderSpecialty":[{"CONCEPT_ID":38004514}]}}],"ObservationWindow":{"PriorDays":0,"PostDays":0},"PrimaryCriteriaLimit":{"Type":"First"}},"QualifiedLimit":{"Type":"All"},"ExpressionLimit":{"Type":"All"},"EndStrategy":{"DateOffset":{"DateField":"EndDate","Offset":0}},"CensoringCriteria":[],"CollapseSettings":{"CollapseType":"ERA","EraPad":0},"CensorWindow":{}}
